{
  "schema": "klt.synth.generic-netlist/1",
  "top": "gcd",
  "ports": [
    {
      "name": "clk",
      "direction": "input",
      "bits": [
        "clk"
      ]
    },
    {
      "name": "rst_n",
      "direction": "input",
      "bits": [
        "rst_n"
      ]
    },
    {
      "name": "start",
      "direction": "input",
      "bits": [
        "start"
      ]
    },
    {
      "name": "a_in",
      "direction": "input",
      "bits": [
        "a_in[15]",
        "a_in[14]",
        "a_in[13]",
        "a_in[12]",
        "a_in[11]",
        "a_in[10]",
        "a_in[9]",
        "a_in[8]",
        "a_in[7]",
        "a_in[6]",
        "a_in[5]",
        "a_in[4]",
        "a_in[3]",
        "a_in[2]",
        "a_in[1]",
        "a_in[0]"
      ]
    },
    {
      "name": "b_in",
      "direction": "input",
      "bits": [
        "b_in[15]",
        "b_in[14]",
        "b_in[13]",
        "b_in[12]",
        "b_in[11]",
        "b_in[10]",
        "b_in[9]",
        "b_in[8]",
        "b_in[7]",
        "b_in[6]",
        "b_in[5]",
        "b_in[4]",
        "b_in[3]",
        "b_in[2]",
        "b_in[1]",
        "b_in[0]"
      ]
    },
    {
      "name": "done",
      "direction": "output",
      "bits": [
        "done"
      ]
    },
    {
      "name": "result",
      "direction": "output",
      "bits": [
        "result[15]",
        "result[14]",
        "result[13]",
        "result[12]",
        "result[11]",
        "result[10]",
        "result[9]",
        "result[8]",
        "result[7]",
        "result[6]",
        "result[5]",
        "result[4]",
        "result[3]",
        "result[2]",
        "result[1]",
        "result[0]"
      ]
    }
  ],
  "cells": [
    {
      "name": "__g0__notgate2_",
      "type": "$not",
      "connections": {
        "A": "rst_n",
        "Y": "__g0__inv1_"
      }
    },
    {
      "name": "_g0_",
      "type": "$dff",
      "connections": {
        "D": "n54",
        "CLK": "clk",
        "Q": "n56",
        "RST": "__g0__inv1_",
        "EN": "n55"
      }
    },
    {
      "name": "__g1__notgate4_",
      "type": "$not",
      "connections": {
        "A": "rst_n",
        "Y": "__g1__inv3_"
      }
    },
    {
      "name": "_g1_",
      "type": "$dff",
      "connections": {
        "D": "n57",
        "CLK": "clk",
        "Q": "n58",
        "RST": "__g1__inv3_",
        "EN": "n55"
      }
    },
    {
      "name": "__g2__notgate6_",
      "type": "$not",
      "connections": {
        "A": "rst_n",
        "Y": "__g2__inv5_"
      }
    },
    {
      "name": "_g2_",
      "type": "$dff",
      "connections": {
        "D": "n59",
        "CLK": "clk",
        "Q": "n60",
        "RST": "__g2__inv5_",
        "EN": "n55"
      }
    },
    {
      "name": "__g3__notgate8_",
      "type": "$not",
      "connections": {
        "A": "rst_n",
        "Y": "__g3__inv7_"
      }
    },
    {
      "name": "_g3_",
      "type": "$dff",
      "connections": {
        "D": "n61",
        "CLK": "clk",
        "Q": "n62",
        "RST": "__g3__inv7_",
        "EN": "n55"
      }
    },
    {
      "name": "__g4__notgate10_",
      "type": "$not",
      "connections": {
        "A": "rst_n",
        "Y": "__g4__inv9_"
      }
    },
    {
      "name": "_g4_",
      "type": "$dff",
      "connections": {
        "D": "n63",
        "CLK": "clk",
        "Q": "n64",
        "RST": "__g4__inv9_",
        "EN": "n55"
      }
    },
    {
      "name": "__g5__notgate12_",
      "type": "$not",
      "connections": {
        "A": "rst_n",
        "Y": "__g5__inv11_"
      }
    },
    {
      "name": "_g5_",
      "type": "$dff",
      "connections": {
        "D": "n65",
        "CLK": "clk",
        "Q": "n66",
        "RST": "__g5__inv11_",
        "EN": "n55"
      }
    },
    {
      "name": "__g6__notgate14_",
      "type": "$not",
      "connections": {
        "A": "rst_n",
        "Y": "__g6__inv13_"
      }
    },
    {
      "name": "_g6_",
      "type": "$dff",
      "connections": {
        "D": "n67",
        "CLK": "clk",
        "Q": "n68",
        "RST": "__g6__inv13_",
        "EN": "n55"
      }
    },
    {
      "name": "__g7__notgate16_",
      "type": "$not",
      "connections": {
        "A": "rst_n",
        "Y": "__g7__inv15_"
      }
    },
    {
      "name": "_g7_",
      "type": "$dff",
      "connections": {
        "D": "n69",
        "CLK": "clk",
        "Q": "n70",
        "RST": "__g7__inv15_",
        "EN": "n55"
      }
    },
    {
      "name": "__g8__notgate18_",
      "type": "$not",
      "connections": {
        "A": "rst_n",
        "Y": "__g8__inv17_"
      }
    },
    {
      "name": "_g8_",
      "type": "$dff",
      "connections": {
        "D": "n71",
        "CLK": "clk",
        "Q": "n72",
        "RST": "__g8__inv17_",
        "EN": "n55"
      }
    },
    {
      "name": "__g9__notgate20_",
      "type": "$not",
      "connections": {
        "A": "rst_n",
        "Y": "__g9__inv19_"
      }
    },
    {
      "name": "_g9_",
      "type": "$dff",
      "connections": {
        "D": "n73",
        "CLK": "clk",
        "Q": "n74",
        "RST": "__g9__inv19_",
        "EN": "n55"
      }
    },
    {
      "name": "__g10__notgate22_",
      "type": "$not",
      "connections": {
        "A": "rst_n",
        "Y": "__g10__inv21_"
      }
    },
    {
      "name": "_g10_",
      "type": "$dff",
      "connections": {
        "D": "n75",
        "CLK": "clk",
        "Q": "n76",
        "RST": "__g10__inv21_",
        "EN": "n55"
      }
    },
    {
      "name": "__g11__notgate24_",
      "type": "$not",
      "connections": {
        "A": "rst_n",
        "Y": "__g11__inv23_"
      }
    },
    {
      "name": "_g11_",
      "type": "$dff",
      "connections": {
        "D": "n77",
        "CLK": "clk",
        "Q": "n78",
        "RST": "__g11__inv23_",
        "EN": "n55"
      }
    },
    {
      "name": "__g12__notgate26_",
      "type": "$not",
      "connections": {
        "A": "rst_n",
        "Y": "__g12__inv25_"
      }
    },
    {
      "name": "_g12_",
      "type": "$dff",
      "connections": {
        "D": "n79",
        "CLK": "clk",
        "Q": "n80",
        "RST": "__g12__inv25_",
        "EN": "n55"
      }
    },
    {
      "name": "__g13__notgate28_",
      "type": "$not",
      "connections": {
        "A": "rst_n",
        "Y": "__g13__inv27_"
      }
    },
    {
      "name": "_g13_",
      "type": "$dff",
      "connections": {
        "D": "n81",
        "CLK": "clk",
        "Q": "n82",
        "RST": "__g13__inv27_",
        "EN": "n55"
      }
    },
    {
      "name": "__g14__notgate30_",
      "type": "$not",
      "connections": {
        "A": "rst_n",
        "Y": "__g14__inv29_"
      }
    },
    {
      "name": "_g14_",
      "type": "$dff",
      "connections": {
        "D": "n83",
        "CLK": "clk",
        "Q": "n84",
        "RST": "__g14__inv29_",
        "EN": "n55"
      }
    },
    {
      "name": "__g15__notgate32_",
      "type": "$not",
      "connections": {
        "A": "rst_n",
        "Y": "__g15__inv31_"
      }
    },
    {
      "name": "_g15_",
      "type": "$dff",
      "connections": {
        "D": "n85",
        "CLK": "clk",
        "Q": "n86",
        "RST": "__g15__inv31_",
        "EN": "n55"
      }
    },
    {
      "name": "__g16__notgate34_",
      "type": "$not",
      "connections": {
        "A": "rst_n",
        "Y": "__g16__inv33_"
      }
    },
    {
      "name": "_g16_",
      "type": "$dff",
      "connections": {
        "D": "n87",
        "CLK": "clk",
        "Q": "done",
        "RST": "__g16__inv33_"
      }
    },
    {
      "name": "__g17__notgate36_",
      "type": "$not",
      "connections": {
        "A": "rst_n",
        "Y": "__g17__inv35_"
      }
    },
    {
      "name": "_g17_",
      "type": "$dff",
      "connections": {
        "D": "n88",
        "CLK": "clk",
        "Q": "result[0]",
        "RST": "__g17__inv35_",
        "EN": "n89"
      }
    },
    {
      "name": "__g18__notgate38_",
      "type": "$not",
      "connections": {
        "A": "rst_n",
        "Y": "__g18__inv37_"
      }
    },
    {
      "name": "_g18_",
      "type": "$dff",
      "connections": {
        "D": "n90",
        "CLK": "clk",
        "Q": "result[1]",
        "RST": "__g18__inv37_",
        "EN": "n89"
      }
    },
    {
      "name": "__g19__notgate40_",
      "type": "$not",
      "connections": {
        "A": "rst_n",
        "Y": "__g19__inv39_"
      }
    },
    {
      "name": "_g19_",
      "type": "$dff",
      "connections": {
        "D": "n91",
        "CLK": "clk",
        "Q": "result[2]",
        "RST": "__g19__inv39_",
        "EN": "n89"
      }
    },
    {
      "name": "__g20__notgate42_",
      "type": "$not",
      "connections": {
        "A": "rst_n",
        "Y": "__g20__inv41_"
      }
    },
    {
      "name": "_g20_",
      "type": "$dff",
      "connections": {
        "D": "n92",
        "CLK": "clk",
        "Q": "result[3]",
        "RST": "__g20__inv41_",
        "EN": "n89"
      }
    },
    {
      "name": "__g21__notgate44_",
      "type": "$not",
      "connections": {
        "A": "rst_n",
        "Y": "__g21__inv43_"
      }
    },
    {
      "name": "_g21_",
      "type": "$dff",
      "connections": {
        "D": "n93",
        "CLK": "clk",
        "Q": "result[4]",
        "RST": "__g21__inv43_",
        "EN": "n89"
      }
    },
    {
      "name": "__g22__notgate46_",
      "type": "$not",
      "connections": {
        "A": "rst_n",
        "Y": "__g22__inv45_"
      }
    },
    {
      "name": "_g22_",
      "type": "$dff",
      "connections": {
        "D": "n94",
        "CLK": "clk",
        "Q": "result[5]",
        "RST": "__g22__inv45_",
        "EN": "n89"
      }
    },
    {
      "name": "__g23__notgate48_",
      "type": "$not",
      "connections": {
        "A": "rst_n",
        "Y": "__g23__inv47_"
      }